post_id,slug,title,target_keyword,volume,kd,cluster,word_count_target,h2_sections,internal_links_to_include,phase,week,status,notes
G001,/guides/irs-treas-310/,"IRS TREAS 310 Complete Guide: Every Code Explained (2025)",irs treas 310,5400,10,irs-refunds,2500,"What Is IRS TREAS 310? | Every IRS TREAS 310 Code and What It Means | IRS TREAS 310 TAX REF | IRS TREAS 310 MISC PAY | How Long Until Deposit Clears | What to Do If You Weren't Expecting It | Frequently Asked Questions",/tax-answers/irs-treas-310-tax-ref/ | /tax-answers/irs-treas-310/ | /tax-answers/how-long-tax-refund-show-bank-account/ | /tax-answers/why-is-receiving-large-tax-refund-bad/,2,4,build,"Publish AFTER all 4 IRS refund Q&A pages are live. Guide links to all of them. Update monthly to reflect current IRS rates/codes."
G002,/guides/backup-withholding/,"Backup Withholding: The Complete IRS Guide (2025)",backup withholding,13000,10,income-concepts,2500,"What Is Backup Withholding? | What Triggers Backup Withholding? | The 24% Backup Withholding Rate | How to Stop Backup Withholding (Form W-9) | Backup Withholding on 1099s | FAQs",/tax-answers/backup-withholding/ | /tax-answers/what-is-backup-withholding/ | /tax-answers/backup-withholding-meaning/ | /tax-answers/taxable-interest/ | /tax-answers/do-llc-get-1099/,2,4,build,"Publish AFTER all 3 backup withholding Q&A pages are live. Highest volume guide. Target featured snippet for 'backup withholding' definition."
G003,/guides/homeowner-tax-deductions/,"Homeowner Tax Deductions 2025: What You Can and Can't Claim",is homeowners insurance tax deductible,3000,2,insurance-deductions,2500,"Mortgage Interest Deduction | Property Tax Deduction | Home Office Deduction | Homeowners Insurance (Not Deductible — Here's Why) | Closing Costs | Home Improvements | Energy Efficiency Credits | Points and Mortgage Insurance | FAQs",/tax-answers/is-homeowners-insurance-tax-deductible/ | /tax-answers/is-home-insurance-tax-deductible/ | /tax-answers/is-mortgage-insurance-tax-deductible/ | /tax-answers/are-closing-costs-tax-deductible/ | /tax-answers/is-car-insurance-tax-deductible/,2,5,build,"Publish AFTER all 5 insurance/homeowner Q&A pages are live. Targets homeowners at tax time. Strong seasonal traffic Nov-April."
G004,/guides/medicare-social-security-tax/,"Medicare & Social Security Tax Guide 2025: Rates, Deductions & Exemptions",what is medicare tax,4200,3,income-concepts,2500,"Medicare Tax Rate and Who Pays It | Social Security Tax Rate | Additional Medicare Tax (0.9%) | Are Medicare Premiums Deductible? | SDI Tax in California | Are Disability Benefits Taxable? | State-by-State Social Security Tax Rules | FAQs",/tax-answers/what-is-medicare-tax/ | /tax-answers/are-medicare-premiums-tax-deductible/ | /tax-answers/sdi-tax/ | /tax-answers/what-is-sdi-tax/ | /tax-answers/are-disability-benefits-taxable/ | /tax-answers/does-california-tax-social-security/,2,5,build,"YMYL health/finance hybrid. Include author byline with credentials. Add Person schema to author."
G005,/guides/california-tax-guide/,"California Tax Guide 2025: Capital Gains, Inheritance, SDI & Social Security",california capital gains tax,4500,4,state-tax,3000,"California State Income Tax Rates | California Capital Gains Tax (No Preferential Rate) | Does California Tax Social Security? | California SDI Tax | California Inheritance Tax (There Isn't One) | Prop 19 and Property Tax | California vs Other States: Tax Comparison | FAQs",/tax-answers/california-capital-gains-tax/ | /tax-answers/does-california-tax-social-security/ | /tax-answers/is-social-security-taxable-in-california/ | /tax-answers/inheritance-tax-california/ | /tax-answers/california-inheritance-tax/ | /tax-answers/prop-19-loopholes/ | /tax-answers/sdi-tax/ | /tax-answers/capital-gains-tax-florida/,3,7,build,"Publish AFTER all 7 California Q&A pages are live. Becomes the California tax cluster hub. High topical authority anchor."
G006,/guides/child-tax-benefits/,"Child-Related Tax Benefits 2025: Who Claims the Child, Child Support & Credits",if you pay child support can you claim the child on your taxes 2026,2900,12,child-family,2500,"Who Claims a Dependent Child? | Custodial vs Non-Custodial Parent Rights | The Form 8332 Release | Child Tax Credit (2025 Amounts) | Head of Household Filing Status | Qualifying Surviving Spouse | Child Support and Taxes | FAQs",/tax-answers/if-i-pay-child-support-can-i-claim-my-child-on-taxes/ | /tax-answers/if-you-pay-child-support-can-you-claim-child-on-taxes-2026/ | /tax-answers/can-father-claim-child-on-taxes/ | /tax-answers/qualifying-widower/ | /tax-answers/can-you-file-head-of-household-if-married/,3,8,build,"Publish AFTER all 5 child-family Q&A pages are live. Update annually — child tax credit amounts change."
G007,/guides/overlooked-tax-deductions/,"25 Tax Deductions You're Probably Missing in 2025",are funeral expenses tax deductible,3900,2,deductions,2500,"Funeral Expenses (Estate Return Only) | Union Dues (State Only Now) | GoFundMe Donations (Charity Only) | Unreimbursed Employee Expenses (State Exceptions) | 401k Contributions | Private School Tuition (529 Rules) | Closing Costs | Medical Expenses Threshold | Job Search Expenses | FAQs",/tax-answers/are-funeral-expenses-tax-deductible/ | /tax-answers/are-union-dues-tax-deductible/ | /tax-answers/are-gofundme-donations-tax-deductible/ | /tax-answers/unreimbursed-employee-expenses/ | /tax-answers/are-401k-contributions-tax-deductible/ | /tax-answers/is-private-school-tuition-tax-deductible/ | /tax-answers/are-closing-costs-tax-deductible/,3,8,build,"Publish last. Most valuable deductions guide — it becomes the hub for the entire deductions cluster. Strong for link building outreach angle."
